{
  "schema": 1,
  "work_id": "work-20260807-runtime-observation",
  "title": "pair-loop observes the running program",
  "status": "design-approved",
  "spec": {
    "path": "docs/work/work-20260807-runtime-observation/spec.md",
    "sha256": "544d39f566189a92da92733afb37e82912f2cd704df53272774ab49d41da929c"
  },
  "active_pair_mirror": ".pair/spec.md",
  "engineering_quality_contract": {
    "path": "docs/work/work-20260807-runtime-observation/spec.md",
    "section": "Engineering Quality Contract",
    "status": "approved"
  },
  "decision_records": [],
  "decision_supersessions": [],
  "changes": [],
  "outcomes": [],
  "evidence_records": []
}
